aocr:regionType,dwc:catalogNumber,dwc:recordedBy,dwc:recordNumber,dwc:verbatimEventDate,aocr:verbatimScientificName,aocr:verbatimInstitution,dwc:datasetName,dwc:verbatimLocality,dwc:country,dwc:stateProvince,dwc:county,dwc:verbatimLatitude,dwc:verbatimLongitude,dwc:eventDate,dwc:scientificName,dwc:decimalLatitude,dwc:decimalLongitude,dwc:fieldNotes,dwc:sex,dwc:identifiedBy,aocr:verbatimDateIdentified,dwc:dateIdentified,dwc:verbatimElevation
curatorial,,,,,,The New York Botanical Garden,,,,,,,,,,,,,,,,,
barcode,01334454,,,,,NEW YORK BOTANICAL GARDEN,,,,,,,,,,,,,,,,,
determination,,,,,Capraria biflora L.,"The University of Texas Herbarium (LL, TEX)",,,,,,,,,Capraria biflora L.,,,,,J. Williams & B.L. Turner,30 Jul 1996,1996-07-30,
primary,,A. H. CURTISS,,"MARCH, 1904",Capraria biflora L,,Plants of the Isle of Pines,Nueva Gerona,,Isle of Pines,,,,1904-03,Capraria biflora L.,,,,,,,,
determination,,,,,C. b.,,,,,,,,,,,,,,,FWP,1919,1919,
