aocr:regionType,dwc:catalogNumber,dwc:recordedBy,dwc:recordNumber,dwc:verbatimEventDate,aocr:verbatimScientificName,aocr:verbatimInstitution,dwc:datasetName,dwc:verbatimLocality,dwc:verbatimLocality2,dwc:country,dwc:stateProvince,dwc:county,dwc:verbatimLatitude,dwc:verbatimLongitude,dwc:eventDate,dwc:scientificName,dwc:decimalLatitude,dwc:decimalLongitude,dwc:fieldNotes,dwc:sex,dwc:identifiedBy,aocr:verbatimDateIdentified,dwc:dateIdentified,dwc:verbatimElevation
curatorial,,,,,,The New York Botanical Garden,,,,,,,,,,,,,,,,,,
barcode,01334354,,,,,NEW YORK BOTANICAL GARDEN,,,,,,,,,,,,,,,,,,
determination,,,,,Buchnera longifolia H.B.K.,The New York Botanical Garden,,,,,,,,,,Buchnera longifolia Kunth,,,,,T. Zanoni,1-1989,1989-01,
determination,,,,,B. longifolia Kunth,,,,,,,,,,,Buchnera longifolia Kunth,,,,,KAV,1986,1986,
primary,,R. A. & E. S. Howard,9350,"Sept. 9, 1946",Buchnera elongata Sw.,,,DOMINICAN REPUBLIC prov. San Juan,Piedra del Aguacate.,DOMINICAN REPUBLIC,prov. San Juan,,,,1946-09-09,Buchnera elongata Sw.,,,Lavender flowered herb of hillsides in pine woods. Plant mixed in with Pteridium.,,,,,
